<?xml version="1.0" encoding="UTF-8"?>
<xs:schema xmlns:xs="http://www.w3.org/2001/XMLSchema">

<xs:element name="BDSMS">
    <xs:complexType>
      <xs:sequence>
        <xs:element name="contacto" maxOccurs="unbounded">
          <xs:complexType>
            <xs:sequence>
              <xs:element name="nombre" type="xs:string"/>
              <xs:element name="telefono" type="xs:string"/>
              <xs:element name="fechaNacimiento" type="xs:date"/>
              <xs:element name="email" type="xs:string"/>
            </xs:sequence>
          </xs:complexType>
        </xs:element>
      </xs:sequence>
    </xs:complexType>
  </xs:element>

</xs:schema>
